[
  {
    "id": "tetris-tango",
    "name": "Tetris Tango",
    "originalBaseGame": "Tetris",
    "coopSpin": "Player 1 controls piece movement (left/right/drop) while Player 2 controls rotation. Both must coordinate in real-time to place pieces efficiently. Neither player can succeed alone.",
    "winRules": "Survive as long as possible. The round ends when the stack reaches the top. High score is based on lines cleared together.",
    "turnRules": "real-time",
    "moveRules": "Player 1: Arrow keys for left, right, soft drop, hard drop. Player 2: Z/X keys for rotate clockwise/counter-clockwise. Pieces fall continuously.",
    "setupInstructions": "Standard 10x20 Tetris grid, empty at start. Random piece queue shared between both players. Piece preview shows next 3 pieces.",
    "playerCount": 2,
    "buildComplexity": "medium",
    "artStyleNotes": "Neon synthwave palette with pink/cyan/purple gradients. Chunky pixel blocks with subtle glow effects. 16x16 tile size. Pulsing background grid lines.",
    "status": "brainstormed",
    "createdAt": "2026-04-08T16:39:31.094Z",
    "approvedAt": null,
    "deployedAt": null
  },
  {
    "id": "snake-charmer",
    "name": "Snake Charmer",
    "originalBaseGame": "Snake",
    "coopSpin": "Player 1 controls the snake's movement. Player 2 is the 'charmer' who places food pellets on the grid and can temporarily create safe walls to guide the snake. Both share a single snake and must communicate.",
    "winRules": "Reach target length (e.g., 50 segments) to win. Lose if the snake hits its own tail or the boundary. Score based on speed of completion.",
    "turnRules": "real-time",
    "moveRules": "Player 1: WASD to change snake direction. Player 2: Mouse click to place food (limited supply, regenerates slowly), hold Shift+click to place temporary barrier (3 second duration, 10 second cooldown).",
    "setupInstructions": "20x20 grid with snake starting at length 3 in the center. Player 2 starts with 3 food items. No initial obstacles.",
    "playerCount": 2,
    "buildComplexity": "small",
    "artStyleNotes": "Garden/nature theme with earthy greens and browns. Snake is a friendly cartoon serpent. Food appears as glowing fruits. Soft pixel art style, 8x8 tiles.",
    "status": "brainstormed",
    "createdAt": "2026-04-08T16:39:31.100Z",
    "approvedAt": null,
    "deployedAt": null
  },
  {
    "id": "pong-volley",
    "name": "Pong Volley",
    "originalBaseGame": "Pong",
    "coopSpin": "Both players are on the same side, controlling two paddles stacked vertically. They must volley the ball against an AI wall that returns shots unpredictably. Players must cover for each other's gaps.",
    "winRules": "Keep a rally going to build a combo multiplier. Every 10 successful returns scores points. Missing the ball ends the rally and resets the multiplier. Reach 1000 points to win.",
    "turnRules": "real-time",
    "moveRules": "Player 1: W/S keys to move upper paddle. Player 2: Up/Down arrows to move lower paddle. Paddles cannot overlap but can touch. Ball speeds up gradually during rallies.",
    "setupInstructions": "Players' paddles on left side of screen (top and bottom halves). AI wall on right side with slight randomness in return angles. Ball starts slow, launches toward AI wall.",
    "playerCount": 2,
    "buildComplexity": "small",
    "artStyleNotes": "Retro arcade black background with white/green phosphor CRT aesthetic. Scanline overlay. Paddles and ball are simple rectangles with slight bloom effect.",
    "status": "brainstormed",
    "createdAt": "2026-04-08T16:39:31.103Z",
    "approvedAt": null,
    "deployedAt": null
  },
  {
    "id": "word-bridge",
    "name": "Word Bridge",
    "originalBaseGame": "Hangman",
    "coopSpin": "Players alternate guessing letters to solve a word, but each player can only see HALF the revealed letters (odd positions vs even positions). They must verbally share clues without saying the actual letters they see.",
    "winRules": "Solve the word before 8 wrong guesses. Bonus points for fewer mistakes. Three words per round, total score determines success.",
    "turnRules": "alternating",
    "moveRules": "Active player types a letter guess. After guessing, players swap. Each player's screen only shows letters in their assigned positions; other positions show '?' even if solved.",
    "setupInstructions": "Random word selected (6-10 letters). Player 1 assigned odd positions, Player 2 assigned even positions. 8 lives represented by bridge planks.",
    "playerCount": 2,
    "buildComplexity": "small",
    "artStyleNotes": "Cozy illustration style with a wooden rope bridge over a chasm. Each wrong guess removes a plank. Warm sunset oranges and soft shadows. Hand-drawn letter tiles.",
    "status": "brainstormed",
    "createdAt": "2026-04-08T16:39:31.106Z",
    "approvedAt": null,
    "deployedAt": null
  },
  {
    "id": "pong-beach-volleyball",
    "name": "Pong: Beach Volleyball",
    "originalBaseGame": "Pong",
    "coopSpin": "Top-down aerial view of a beach court with Pong-style scoring: get the ball past the opponent's back edge to score. But both sides play symmetric 2v2 volleyball — exactly 3 touches per side before the ball must cross the midline, no single player can touch it twice in a row, and hits 1 and 2 auto-arc toward whichever teammate did NOT just touch it (bump → set) while hit 3 auto-launches as a fast rocket punch across the court. A lateral 'court gravity' pulls the ball toward the rallying side's OWN back wall during bumps and sets, so the passes arc like real volleyball — and if your partner doesn't move to receive, the ball drifts past your own edge and you lose the point.",
    "winRules": "First team to 7 points wins the set. A point is scored when the ball crosses the opponent's back edge (past both of their players), OR when the opponent whiffs their own bump/set and the ball drifts off their own back wall under court gravity. The dashed midline is not a net — the ball always crosses it freely.",
    "turnRules": "real-time",
    "moveRules": "Player 1: WASD — free 2D movement anywhere on the near (left) half of the court. Player 2: Arrow keys — free 2D movement anywhere on the near (left) half. Players pass through each other (no collisions). Contact with the ball counts as a hit — no explicit hit button. On hits 1 and 2 the ball auto-aims at the OTHER teammate's current position and arcs toward them under leftward court gravity. On hit 3 the ball auto-launches as a rocket punch aimed at the gap between the two AI defenders. Alternation is enforced — the player who just hit cannot hit again until either the opponent touches the ball or it crosses the midline. The two AI opponents on the far side play by identical rules, mirrored (rightward court gravity).",
    "setupInstructions": "Horizontal court with a dashed vertical line down the middle (not a net — purely visual). Top and bottom edges are walls; left and right edges are open scoring zones. Team of two human players controls the left half; two AI players cover the right half. AI players default to top-back and bottom-back resting positions when awaiting a rocket; during their own offense one AI takes the ball and the other anticipates where the arcing pass will land. Ball serves from near the midline toward the receiving side. HUD at top of screen shows TEAM score, AI score, and 'FIRST TO 7'. Hit-count label ('PASS' or 'SET') floats near the ball during each side's rally.",
    "playerCount": 2,
    "buildComplexity": "medium",
    "artStyleNotes": "Top-down aerial view on a sandy beach court, GameBoy DMG palette (4 greens). Sandy background with faint texture dots. Court outlined in the darkest green with a dashed centerline. Team players rendered as light filled circles labeled 1 and 2; AI players as dark filled circles with small X marks to visually contrast. Ball is a light circle with a horizontal seam (volleyball hint). During a rocket punch the ball trails a short directional dark line to sell the speed. Chunky 16x16 pixel aesthetic at 320x240 logical resolution, scaled ×3.",
    "status": "deployed",
    "createdAt": "2026-04-08T17:00:00.000Z",
    "approvedAt": "2026-04-08T17:00:00.000Z",
    "deployedAt": "2026-04-08T17:30:00.000Z"
  },
  {
    "id": "rhythm-relay",
    "name": "Rhythm Relay",
    "originalBaseGame": "Guitar Hero / Dance Dance Revolution",
    "coopSpin": "Note lanes are split between players — Player 1 handles left two lanes, Player 2 handles right two lanes. Some special 'bridge notes' span the middle and either player can hit them, requiring awareness of who's free.",
    "winRules": "Complete the song with combined accuracy above 80% to pass. Letter grade based on total percentage. Three misses in a row by the team ends the song early.",
    "turnRules": "real-time",
    "moveRules": "Player 1: A/S keys for their two lanes. Player 2: K/L keys for their two lanes. Bridge notes in center can be hit by either player using their inner key (S or K).",
    "setupInstructions": "Select from 3 songs of increasing difficulty. 4-lane highway with notes scrolling down. BPM and note patterns pre-mapped to royalty-free music.",
    "playerCount": 2,
    "buildComplexity": "medium",
    "artStyleNotes": "Vibrant disco/club aesthetic with rainbow gradients and particle bursts on hits. Dark purple background. Notes are glowing diamonds. Screen shake on perfect hits.",
    "status": "brainstormed",
    "createdAt": "2026-04-08T16:39:31.111Z",
    "approvedAt": null,
    "deployedAt": null
  }
]
